{
  "id": "PI-C-0083",
  "category": "Desktop Computer — Small Modular Desktop",
  "slug": "desktop-computer-small-modular-desktop",
  "status": "SPLIT_REQUIRED",
  "constitutionVersion": "1.1.0",
  "form": {
    "statement": "A modular desktop child Form has a declaration path, but the parent cannot hide capacity, upgrade, and software differences under one model.",
    "scope": "Imported from the 100-record register as a nonterminal SPLIT_REQUIRED research case. The ordinary use context, jurisdiction, and exact Form boundary remain part of adjudication.",
    "exclusions": [
      "Proprietary boards or power supplies, sealed all-in-ones, hidden thermal limits, unstable platform identity, and one answer that ignores workload or upgrade Form."
    ]
  },
  "subject": {
    "manufacturer": "",
    "model": "",
    "modelIdentifier": "",
    "productionLineage": "Exact model identity and production continuity remain to be verified."
  },
  "gates": [],
  "hardDisqualifiers": [],
  "evidenceIds": [],
  "evidenceGaps": [
    "Attach at least one primary technical or service source.",
    "Attach independent evidence of longevity, failure behavior, or repair economics.",
    "Record the strongest counter-case and the exact model or child Form boundary."
  ],
  "categorySearch": {
    "protocol": "Research disposition imported from the canonical register. The case must record the candidate set, search coverage, and why the chosen Form is coherent before terminal review.",
    "candidateSet": [
      "No exact subject named; Form or category split required"
    ]
  },
  "failureModes": [
    {
      "mode": "Register failure-mode record",
      "severity": "MEDIUM",
      "remedy": "Power supply or motherboard failure, thermal failure, platform incompatibility, storage wear, and software obsolescence."
    }
  ],
  "maintenance": "Replace storage, memory, fans, power supply, and other supported components; rebuild when platform changes make it rational.",
  "repairEconomics": "Not yet established. Compare parts, labor, access, downtime, and rational replacement cost before terminal review.",
  "counterCase": {
    "claim": "A serious alternative or incompatible sub-Form may answer the same broad category differently.",
    "disposition": "Counter-case not yet adjudicated; do not issue a terminal ruling until the strongest alternative is recorded and answered."
  },
  "futureRequirement": "Complete the evidence packet, five-gate findings, hard-disqualifier review, and human adjudication before promotion to DECLARED or EMPTY.",
  "confidence": 2,
  "notes": "Constitutional Batch 08 research disposition: broad parent split required; child declaration path identified. Seeded from the 100-record migration as a formal nonterminal case; this file does not issue a public ruling."
}
