{
  "id": "PI-C-0061",
  "category": "Toothbrush",
  "slug": "toothbrush",
  "status": "CONSUMABLE",
  "constitutionVersion": "1.1.0",
  "form": {
    "statement": "FUNDAMENTALLY CONSUMABLE like pen refills or razor blades.",
    "scope": "Imported from the 100-record register as a nonterminal CONSUMABLE research case. The ordinary use context, jurisdiction, and exact Form boundary remain part of adjudication.",
    "exclusions": [
      "Electric brushes clean well but add battery/motor failure modes and higher lifecycle cost; premium manual brushes do not extend bristle lifespan."
    ]
  },
  "subject": {
    "manufacturer": "",
    "model": "Oral-B Indicator Soft (manual)",
    "modelIdentifier": "",
    "productionLineage": "Exact model identity and production continuity remain to be verified."
  },
  "gates": [],
  "hardDisqualifiers": [],
  "evidenceIds": [],
  "evidenceGaps": [
    "Attach at least one primary technical or service source.",
    "Attach independent evidence of longevity, failure behavior, or repair economics.",
    "Record the strongest counter-case and the exact model or child Form boundary."
  ],
  "categorySearch": {
    "protocol": "Research disposition imported from the canonical register. The case must record the candidate set, search coverage, and why the chosen Form is coherent before terminal review.",
    "candidateSet": [
      "Oral-B Indicator Soft (manual)"
    ]
  },
  "failureModes": [],
  "maintenance": "every 3-4 months",
  "repairEconomics": "Not yet established. Compare parts, labor, access, downtime, and rational replacement cost before terminal review.",
  "counterCase": {
    "claim": "A serious alternative or incompatible sub-Form may answer the same broad category differently.",
    "disposition": "Counter-case not yet adjudicated; do not issue a terminal ruling until the strongest alternative is recorded and answered."
  },
  "futureRequirement": "Complete the evidence packet, five-gate findings, hard-disqualifier review, and human adjudication before promotion to DECLARED or EMPTY.",
  "confidence": 2,
  "notes": "Multiple products listed; category must be split or a single default declared. Split suggested: Manual Toothbrush vs Electric Toothbrush base. Seeded from the 100-record migration as a formal nonterminal case; this file does not issue a public ruling."
}
