{
  "id": "PI-C-0075",
  "category": "Cooler — Portable Hard 40–50 Quart",
  "slug": "cooler-portable-hard-40-50-quart",
  "status": "CANDIDATE",
  "constitutionVersion": "1.1.0",
  "form": {
    "statement": "A rotomolded cooler can end the search inside its size and use Form when hinges, latches, gasket, drain, and warranty support are verified.",
    "scope": "Imported from the 100-record register as a nonterminal CANDIDATE research case. The ordinary use context, jurisdiction, and exact Form boundary remain part of adjudication.",
    "exclusions": [
      "Unserviceable latches, unavailable gasket or drain parts, shell failure treated as repairable, and a size or use case outside the bounded Form."
    ]
  },
  "subject": {
    "manufacturer": "",
    "model": "YETI Tundra 45 Hard Cooler, product 10045020000",
    "modelIdentifier": "",
    "productionLineage": "Exact model identity and production continuity remain to be verified."
  },
  "gates": [],
  "hardDisqualifiers": [],
  "evidenceIds": [],
  "evidenceGaps": [
    "Attach at least one primary technical or service source.",
    "Attach independent evidence of longevity, failure behavior, or repair economics.",
    "Record the strongest counter-case and the exact model or child Form boundary."
  ],
  "categorySearch": {
    "protocol": "Research disposition imported from the canonical register. The case must record the candidate set, search coverage, and why the chosen Form is coherent before terminal review.",
    "candidateSet": [
      "YETI Tundra 45 Hard Cooler, product 10045020000"
    ]
  },
  "failureModes": [
    {
      "mode": "Register failure-mode record",
      "severity": "MEDIUM",
      "remedy": "Latch or hinge failure, gasket compression, drain damage, insulation loss, shell cracking, and overloading."
    }
  ],
  "maintenance": "Replace latches, gasket, drain hardware, or other serviceable interfaces; protect the body from destructive impact.",
  "repairEconomics": "Not yet established. Compare parts, labor, access, downtime, and rational replacement cost before terminal review.",
  "counterCase": {
    "claim": "A serious alternative or incompatible sub-Form may answer the same broad category differently.",
    "disposition": "Counter-case not yet adjudicated; do not issue a terminal ruling until the strongest alternative is recorded and answered."
  },
  "futureRequirement": "Complete the evidence packet, five-gate findings, hard-disqualifier review, and human adjudication before promotion to DECLARED or EMPTY.",
  "confidence": 3,
  "notes": "Constitutional Batch 08 research disposition: declaration path. Candidate only; not a terminal ruling. Seeded from the 100-record migration as a formal nonterminal case; this file does not issue a public ruling."
}
