{
  "id": "PI-C-0098",
  "category": "Razor — Closed-Comb Double-Edge",
  "slug": "razor-closed-comb-double-edge",
  "status": "CANDIDATE",
  "constitutionVersion": "1.1.0",
  "form": {
    "statement": "The 34C is a strong candidate inside a closed-comb double-edge Form because the razor body persists while blades renew rationally.",
    "scope": "Imported from the 100-record register as a nonterminal CANDIDATE research case. The ordinary use context, jurisdiction, and exact Form boundary remain part of adjudication.",
    "exclusions": [
      "Proprietary cartridges, sealed batteries, nonstandard blades, unsafe geometry, unserviceable threads, and shaving preferences outside the closed-comb Form."
    ]
  },
  "subject": {
    "manufacturer": "",
    "model": "MERKUR 34C, SKU 34001",
    "modelIdentifier": "",
    "productionLineage": "Exact model identity and production continuity remain to be verified."
  },
  "gates": [],
  "hardDisqualifiers": [],
  "evidenceIds": [],
  "evidenceGaps": [
    "Attach at least one primary technical or service source.",
    "Attach independent evidence of longevity, failure behavior, or repair economics.",
    "Record the strongest counter-case and the exact model or child Form boundary."
  ],
  "categorySearch": {
    "protocol": "Research disposition imported from the canonical register. The case must record the candidate set, search coverage, and why the chosen Form is coherent before terminal review.",
    "candidateSet": [
      "MERKUR 34C, SKU 34001"
    ]
  },
  "failureModes": [
    {
      "mode": "Register failure-mode record",
      "severity": "MEDIUM",
      "remedy": "Blade wear, thread damage, corrosion, dropped-head damage, and user technique errors."
    }
  ],
  "maintenance": "Replace standard blades; clean, inspect, and replace the handle or head if supported.",
  "repairEconomics": "Not yet established. Compare parts, labor, access, downtime, and rational replacement cost before terminal review.",
  "counterCase": {
    "claim": "A serious alternative or incompatible sub-Form may answer the same broad category differently.",
    "disposition": "Counter-case not yet adjudicated; do not issue a terminal ruling until the strongest alternative is recorded and answered."
  },
  "futureRequirement": "Complete the evidence packet, five-gate findings, hard-disqualifier review, and human adjudication before promotion to DECLARED or EMPTY.",
  "confidence": 3,
  "notes": "Constitutional Batch 10 research disposition: declaration path. Candidate only; scoped to closed-comb double-edge. Seeded from the 100-record migration as a formal nonterminal case; this file does not issue a public ruling."
}
