{
  "id": "PI-C-0073",
  "category": "Pillow",
  "slug": "pillow",
  "status": "CANDIDATE",
  "constitutionVersion": "1.1.0",
  "form": {
    "statement": "The research points toward rational consumption rather than a durable declaration; no terminal EMPTY ruling has been issued here.",
    "scope": "Imported from the 100-record register as a nonterminal CANDIDATE research case. The ordinary use context, jurisdiction, and exact Form boundary remain part of adjudication.",
    "exclusions": [
      "Intrinsic loft loss, nonrenewable foam or fill, hygiene limits, and renewal costs that approach replacement."
    ]
  },
  "subject": {
    "manufacturer": "",
    "model": "",
    "modelIdentifier": "",
    "productionLineage": "Exact model identity and production continuity remain to be verified."
  },
  "gates": [],
  "hardDisqualifiers": [],
  "evidenceIds": [],
  "evidenceGaps": [
    "Attach at least one primary technical or service source.",
    "Attach independent evidence of longevity, failure behavior, or repair economics.",
    "Record the strongest counter-case and the exact model or child Form boundary."
  ],
  "categorySearch": {
    "protocol": "Research disposition imported from the canonical register. The case must record the candidate set, search coverage, and why the chosen Form is coherent before terminal review.",
    "candidateSet": [
      "No exact subject named; Form or category split required"
    ]
  },
  "failureModes": [
    {
      "mode": "Register failure-mode record",
      "severity": "MEDIUM",
      "remedy": "Loss of loft, clumping, foam breakdown, contamination, odor retention, and failed covers."
    }
  ],
  "maintenance": "Fluffing, cleaning, refilling, or replacement would need to be evaluated as the category's honest permanence mechanism.",
  "repairEconomics": "Not yet established. Compare parts, labor, access, downtime, and rational replacement cost before terminal review.",
  "counterCase": {
    "claim": "A serious alternative or incompatible sub-Form may answer the same broad category differently.",
    "disposition": "Counter-case not yet adjudicated; do not issue a terminal ruling until the strongest alternative is recorded and answered."
  },
  "futureRequirement": "Complete the evidence packet, five-gate findings, hard-disqualifier review, and human adjudication before promotion to DECLARED or EMPTY.",
  "confidence": 2,
  "notes": "Constitutional Batch 07 research disposition: EMPTY path for a durable pillow ideal. Stored as CANDIDATE pending a rational-renewal case. Seeded from the 100-record migration as a formal nonterminal case; this file does not issue a public ruling."
}
