{
  "id": "PI-C-0082",
  "category": "Laptop — Repairable General-Purpose",
  "slug": "laptop-repairable-general-purpose",
  "status": "CANDIDATE",
  "constitutionVersion": "1.1.0",
  "form": {
    "statement": "The Framework 13 is the leading candidate inside a repairable general-purpose laptop Form, subject to exact generation and support evidence.",
    "scope": "Imported from the 100-record register as a nonterminal CANDIDATE research case. The ordinary use context, jurisdiction, and exact Form boundary remain part of adjudication.",
    "exclusions": [
      "Soldered critical components, unavailable modules, short software support, proprietary lockout, unstable generation compatibility, and repair cost that exceeds rational renewal."
    ]
  },
  "subject": {
    "manufacturer": "",
    "model": "Framework Laptop 13 DIY Edition, AMD Ryzen AI 300 Series",
    "modelIdentifier": "",
    "productionLineage": "Exact model identity and production continuity remain to be verified."
  },
  "gates": [],
  "hardDisqualifiers": [],
  "evidenceIds": [],
  "evidenceGaps": [
    "Attach at least one primary technical or service source.",
    "Attach independent evidence of longevity, failure behavior, or repair economics.",
    "Record the strongest counter-case and the exact model or child Form boundary."
  ],
  "categorySearch": {
    "protocol": "Research disposition imported from the canonical register. The case must record the candidate set, search coverage, and why the chosen Form is coherent before terminal review.",
    "candidateSet": [
      "Framework Laptop 13 DIY Edition, AMD Ryzen AI 300 Series"
    ]
  },
  "failureModes": [
    {
      "mode": "Register failure-mode record",
      "severity": "MEDIUM",
      "remedy": "Battery degradation, display or port damage, keyboard wear, hinge failure, and platform or software obsolescence."
    }
  ],
  "maintenance": "Replace battery, storage, memory, display, keyboard, ports, and other supported modules.",
  "repairEconomics": "Not yet established. Compare parts, labor, access, downtime, and rational replacement cost before terminal review.",
  "counterCase": {
    "claim": "A serious alternative or incompatible sub-Form may answer the same broad category differently.",
    "disposition": "Counter-case not yet adjudicated; do not issue a terminal ruling until the strongest alternative is recorded and answered."
  },
  "futureRequirement": "Complete the evidence packet, five-gate findings, hard-disqualifier review, and human adjudication before promotion to DECLARED or EMPTY.",
  "confidence": 3,
  "notes": "Constitutional Batch 08 research disposition: declaration path. Candidate only; exact variant and evidence packet required. Seeded from the 100-record migration as a formal nonterminal case; this file does not issue a public ruling."
}
