{
  "id": "PI-C-0076",
  "category": "Water Bottle — Single-Wall Everyday",
  "slug": "water-bottle-single-wall-everyday",
  "status": "CANDIDATE",
  "constitutionVersion": "1.1.0",
  "form": {
    "statement": "The bottle Form is complete when the steel body is inert and the cap and seal remain replaceable without proprietary lock-in.",
    "scope": "Imported from the 100-record register as a nonterminal CANDIDATE research case. The ordinary use context, jurisdiction, and exact Form boundary remain part of adjudication.",
    "exclusions": [
      "Coatings that chip, nonreplaceable seals, proprietary cap lock-in, threaded failures, and body designs that cannot be cleaned or serviced."
    ]
  },
  "subject": {
    "manufacturer": "",
    "model": "Klean Kanteen Classic 27 oz, current sport-cap configuration",
    "modelIdentifier": "",
    "productionLineage": "Exact model identity and production continuity remain to be verified."
  },
  "gates": [],
  "hardDisqualifiers": [],
  "evidenceIds": [],
  "evidenceGaps": [
    "Attach at least one primary technical or service source.",
    "Attach independent evidence of longevity, failure behavior, or repair economics.",
    "Record the strongest counter-case and the exact model or child Form boundary."
  ],
  "categorySearch": {
    "protocol": "Research disposition imported from the canonical register. The case must record the candidate set, search coverage, and why the chosen Form is coherent before terminal review.",
    "candidateSet": [
      "Klean Kanteen Classic 27 oz, current sport-cap configuration"
    ]
  },
  "failureModes": [
    {
      "mode": "Register failure-mode record",
      "severity": "MEDIUM",
      "remedy": "Dropped or dented body, cap cracking, gasket wear, thread damage, and odor or hygiene failure."
    }
  ],
  "maintenance": "Replace cap, gasket, or lid; clean and inspect threads and body.",
  "repairEconomics": "Not yet established. Compare parts, labor, access, downtime, and rational replacement cost before terminal review.",
  "counterCase": {
    "claim": "A serious alternative or incompatible sub-Form may answer the same broad category differently.",
    "disposition": "Counter-case not yet adjudicated; do not issue a terminal ruling until the strongest alternative is recorded and answered."
  },
  "futureRequirement": "Complete the evidence packet, five-gate findings, hard-disqualifier review, and human adjudication before promotion to DECLARED or EMPTY.",
  "confidence": 3,
  "notes": "Constitutional Batch 08 research disposition: declaration path. Candidate only; scoped to single-wall everyday carry. Seeded from the 100-record migration as a formal nonterminal case; this file does not issue a public ruling."
}
