{
  "id": "PI-C-0094",
  "category": "Furnace — Defined Gas Forced-Air Form",
  "slug": "furnace-defined-gas-forced-air-form",
  "status": "SPLIT_REQUIRED",
  "constitutionVersion": "1.1.0",
  "form": {
    "statement": "A precise gas forced-air child Form may be declarable, but no furnace can be universal without load, orientation, installation, and jurisdiction.",
    "scope": "Imported from the 100-record register as a nonterminal SPLIT_REQUIRED research case. The ordinary use context, jurisdiction, and exact Form boundary remain part of adjudication.",
    "exclusions": [
      "Wrong capacity, unsafe installation, unavailable controls or ignition parts, unsupported heat exchanger, code mismatch, and professional-service assumptions hidden from the reader."
    ]
  },
  "subject": {
    "manufacturer": "",
    "model": "",
    "modelIdentifier": "",
    "productionLineage": "Exact model identity and production continuity remain to be verified."
  },
  "gates": [],
  "hardDisqualifiers": [],
  "evidenceIds": [],
  "evidenceGaps": [
    "Attach at least one primary technical or service source.",
    "Attach independent evidence of longevity, failure behavior, or repair economics.",
    "Record the strongest counter-case and the exact model or child Form boundary."
  ],
  "categorySearch": {
    "protocol": "Research disposition imported from the canonical register. The case must record the candidate set, search coverage, and why the chosen Form is coherent before terminal review.",
    "candidateSet": [
      "No exact subject named; Form or category split required"
    ]
  },
  "failureModes": [
    {
      "mode": "Register failure-mode record",
      "severity": "MEDIUM",
      "remedy": "Ignition or control failure, inducer or blower failure, heat-exchanger failure, venting issue, and repair economics."
    }
  ],
  "maintenance": "Qualified inspection and service; replace ignition, controls, inducer, blower, and supported components.",
  "repairEconomics": "Not yet established. Compare parts, labor, access, downtime, and rational replacement cost before terminal review.",
  "counterCase": {
    "claim": "A serious alternative or incompatible sub-Form may answer the same broad category differently.",
    "disposition": "Counter-case not yet adjudicated; do not issue a terminal ruling until the strongest alternative is recorded and answered."
  },
  "futureRequirement": "Complete the evidence packet, five-gate findings, hard-disqualifier review, and human adjudication before promotion to DECLARED or EMPTY.",
  "confidence": 2,
  "notes": "Constitutional Batch 10 research disposition: parent split required; exact capacity and orientation must be selected before a candidate case. Seeded from the 100-record migration as a formal nonterminal case; this file does not issue a public ruling."
}
