{
  "id": "PI-C-0014",
  "category": "Task Chair",
  "slug": "task-chair",
  "status": "SPLIT_REQUIRED",
  "constitutionVersion": "1.1.0",
  "form": {
    "statement": "Mesh suspension doesn't compress like foam.",
    "scope": "Imported from the 100-record register as a nonterminal SPLIT_REQUIRED research case. The ordinary use context, jurisdiction, and exact Form boundary remain part of adjudication.",
    "exclusions": [
      "New pricing irrational for repair economics. Steelcase Leap has similar rebuildability but foam seats compress over 10+ years (foam replacement requires reupholstery). IKEA Markus ($250) sealed construction-gas cylinder failure requires drilling out rivets, non-recoverable. Used Aeron market is actual answer but buy used weakens clean declaration since condition varies and seller reliability matters."
    ]
  },
  "subject": {
    "manufacturer": "",
    "model": "",
    "modelIdentifier": "",
    "productionLineage": "Exact model identity and production continuity remain to be verified."
  },
  "gates": [],
  "hardDisqualifiers": [],
  "evidenceIds": [],
  "evidenceGaps": [
    "Attach at least one primary technical or service source.",
    "Attach independent evidence of longevity, failure behavior, or repair economics.",
    "Record the strongest counter-case and the exact model or child Form boundary."
  ],
  "categorySearch": {
    "protocol": "Research disposition imported from the canonical register. The case must record the candidate set, search coverage, and why the chosen Form is coherent before terminal review.",
    "candidateSet": [
      "No exact subject named; Form or category split required"
    ]
  },
  "failureModes": [],
  "maintenance": "To be established from primary service evidence.",
  "repairEconomics": "Not yet established. Compare parts, labor, access, downtime, and rational replacement cost before terminal review.",
  "counterCase": {
    "claim": "A serious alternative or incompatible sub-Form may answer the same broad category differently.",
    "disposition": "Counter-case not yet adjudicated; do not issue a terminal ruling until the strongest alternative is recorded and answered."
  },
  "futureRequirement": "Complete the evidence packet, five-gate findings, hard-disqualifier review, and human adjudication before promotion to DECLARED or EMPTY.",
  "confidence": 3,
  "notes": "Split into Task Chair (New) vs Task Chair (Used). Keep parent as index only. Seeded from the 100-record migration as a formal nonterminal case; this file does not issue a public ruling."
}
