{
  "id": "PI-C-0066",
  "category": "Sofa / Couch",
  "slug": "sofa-couch",
  "status": "CONDITIONAL",
  "constitutionVersion": "1.1.0",
  "form": {
    "statement": "A sofa can approach the Form only when its structure survives and its comfort materials can be renewed rationally.",
    "scope": "Imported from the 100-record register as a nonterminal CONDITIONAL research case. The ordinary use context, jurisdiction, and exact Form boundary remain part of adjudication.",
    "exclusions": [
      "Particleboard frames, sealed cushions, non-replaceable covers, inaccessible springs, and refurbishment costs that exceed a rational ownership horizon."
    ]
  },
  "subject": {
    "manufacturer": "",
    "model": "Model pending — hardwood frame with replaceable upholstery",
    "modelIdentifier": "",
    "productionLineage": "Exact model identity and production continuity remain to be verified."
  },
  "gates": [],
  "hardDisqualifiers": [],
  "evidenceIds": [],
  "evidenceGaps": [
    "Attach at least one primary technical or service source.",
    "Attach independent evidence of longevity, failure behavior, or repair economics.",
    "Record the strongest counter-case and the exact model or child Form boundary."
  ],
  "categorySearch": {
    "protocol": "Research disposition imported from the canonical register. The case must record the candidate set, search coverage, and why the chosen Form is coherent before terminal review.",
    "candidateSet": [
      "Model pending — hardwood frame with replaceable upholstery"
    ]
  },
  "failureModes": [
    {
      "mode": "Register failure-mode record",
      "severity": "MEDIUM",
      "remedy": "Foam compression, torn covers, spring fatigue, frame joint loosening, and refurbishment cost escalation."
    }
  ],
  "maintenance": "Replace or reupholster cushions and covers; repair springs and frame joints as needed.",
  "repairEconomics": "Not yet established. Compare parts, labor, access, downtime, and rational replacement cost before terminal review.",
  "counterCase": {
    "claim": "A serious alternative or incompatible sub-Form may answer the same broad category differently.",
    "disposition": "Counter-case not yet adjudicated; do not issue a terminal ruling until the strongest alternative is recorded and answered."
  },
  "futureRequirement": "Complete the evidence packet, five-gate findings, hard-disqualifier review, and human adjudication before promotion to DECLARED or EMPTY.",
  "confidence": 2,
  "notes": "Constitutional Batch 07 research disposition: conditional and borderline empty. Keep nonterminal until one Form and one subject survive the counter-case. Seeded from the 100-record migration as a formal nonterminal case; this file does not issue a public ruling."
}
