{
  "id": "PI-C-0084",
  "category": "Television — External-Source Display",
  "slug": "television-external-source-display",
  "status": "SPLIT_REQUIRED",
  "constitutionVersion": "1.1.0",
  "form": {
    "statement": "No universal television declaration is honest until panel, smart-layer, duty-cycle, and service Forms are separated.",
    "scope": "Imported from the 100-record register as a nonterminal SPLIT_REQUIRED research case. The ordinary use context, jurisdiction, and exact Form boundary remain part of adjudication.",
    "exclusions": [
      "Panel treated as economically repairable without proof, unsupported smart layer, incompatible duty cycle, hidden service restrictions, and category substitution."
    ]
  },
  "subject": {
    "manufacturer": "",
    "model": "",
    "modelIdentifier": "",
    "productionLineage": "Exact model identity and production continuity remain to be verified."
  },
  "gates": [],
  "hardDisqualifiers": [],
  "evidenceIds": [],
  "evidenceGaps": [
    "Attach at least one primary technical or service source.",
    "Attach independent evidence of longevity, failure behavior, or repair economics.",
    "Record the strongest counter-case and the exact model or child Form boundary."
  ],
  "categorySearch": {
    "protocol": "Research disposition imported from the canonical register. The case must record the candidate set, search coverage, and why the chosen Form is coherent before terminal review.",
    "candidateSet": [
      "No exact subject named; Form or category split required"
    ]
  },
  "failureModes": [
    {
      "mode": "Register failure-mode record",
      "severity": "MEDIUM",
      "remedy": "Panel failure, power-board failure, port failure, backlight failure, software abandonment, and unavailable parts."
    }
  ],
  "maintenance": "Board, power, port, backlight, and software maintenance depend on the child Form; panel replacement remains the critical open question.",
  "repairEconomics": "Not yet established. Compare parts, labor, access, downtime, and rational replacement cost before terminal review.",
  "counterCase": {
    "claim": "A serious alternative or incompatible sub-Form may answer the same broad category differently.",
    "disposition": "Counter-case not yet adjudicated; do not issue a terminal ruling until the strongest alternative is recorded and answered."
  },
  "futureRequirement": "Complete the evidence packet, five-gate findings, hard-disqualifier review, and human adjudication before promotion to DECLARED or EMPTY.",
  "confidence": 2,
  "notes": "Constitutional Batch 09 research disposition: preserve split. No universal television model named. Seeded from the 100-record migration as a formal nonterminal case; this file does not issue a public ruling."
}
