{
  "id": "PI-C-0087",
  "category": "Speakers — Passive Living-Room",
  "slug": "speakers-passive-living-room",
  "status": "CANDIDATE",
  "constitutionVersion": "1.1.0",
  "form": {
    "statement": "A passive speaker Form can remain in service as electronics and drivers are separately serviceable, but room and taste remain explicit limits.",
    "scope": "Imported from the 100-record register as a nonterminal CANDIDATE research case. The ordinary use context, jurisdiction, and exact Form boundary remain part of adjudication.",
    "exclusions": [
      "Integrated amplification, sealed electronics, unavailable drivers or crossover parts, unserviceable cabinet, and treating room preference as objective failure."
    ]
  },
  "subject": {
    "manufacturer": "",
    "model": "Klipsch Heresy IV, current model",
    "modelIdentifier": "",
    "productionLineage": "Exact model identity and production continuity remain to be verified."
  },
  "gates": [],
  "hardDisqualifiers": [],
  "evidenceIds": [],
  "evidenceGaps": [
    "Attach at least one primary technical or service source.",
    "Attach independent evidence of longevity, failure behavior, or repair economics.",
    "Record the strongest counter-case and the exact model or child Form boundary."
  ],
  "categorySearch": {
    "protocol": "Research disposition imported from the canonical register. The case must record the candidate set, search coverage, and why the chosen Form is coherent before terminal review.",
    "candidateSet": [
      "Klipsch Heresy IV, current model"
    ]
  },
  "failureModes": [
    {
      "mode": "Register failure-mode record",
      "severity": "MEDIUM",
      "remedy": "Driver or crossover failure, cabinet damage, terminal failure, grille wear, and mismatch to room or listening Form."
    }
  ],
  "maintenance": "Replace or service drivers, crossover components, terminals, grille, and cabinet finish where supported.",
  "repairEconomics": "Not yet established. Compare parts, labor, access, downtime, and rational replacement cost before terminal review.",
  "counterCase": {
    "claim": "A serious alternative or incompatible sub-Form may answer the same broad category differently.",
    "disposition": "Counter-case not yet adjudicated; do not issue a terminal ruling until the strongest alternative is recorded and answered."
  },
  "futureRequirement": "Complete the evidence packet, five-gate findings, hard-disqualifier review, and human adjudication before promotion to DECLARED or EMPTY.",
  "confidence": 2,
  "notes": "Constitutional Batch 09 research disposition: declaration path. Candidate only; exact current model and evidence packet required. Seeded from the 100-record migration as a formal nonterminal case; this file does not issue a public ruling."
}
