{
  "id": "PI-C-0048",
  "category": "Food Storage Container",
  "slug": "food-storage-container",
  "status": "SPLIT_REQUIRED",
  "constitutionVersion": "1.1.0",
  "form": {
    "statement": "Glass containers indefinite lifespan.",
    "scope": "Imported from the 100-record register as a nonterminal SPLIT_REQUIRED research case. The ordinary use context, jurisdiction, and exact Form boundary remain part of adjudication.",
    "exclusions": [
      "Plastic (Tupperware, Rubbermaid, Ziploc $15-20) stains from tomato/turmeric, absorbs odors, warps in dishwasher, lids lose seal, 3-7 years before replacement. Premium plastic (Sistema, OXO) similar degradation despite higher initial cost. Current Pyrex (soda-lime) less thermal shock resistant than vintage borosilicate (can shatter cold water on hot glass). Lids are weak point for all glass storage-plastic/silicone components consumable but glass itself permanent. This is pragmatic compromise: glass indefinite, accept lid replacement every 5-10 years at $5-15 each (routine maintenance not engineered obsolescence)."
    ]
  },
  "subject": {
    "manufacturer": "",
    "model": "",
    "modelIdentifier": "",
    "productionLineage": "Exact model identity and production continuity remain to be verified."
  },
  "gates": [],
  "hardDisqualifiers": [],
  "evidenceIds": [],
  "evidenceGaps": [
    "Attach at least one primary technical or service source.",
    "Attach independent evidence of longevity, failure behavior, or repair economics.",
    "Record the strongest counter-case and the exact model or child Form boundary."
  ],
  "categorySearch": {
    "protocol": "Research disposition imported from the canonical register. The case must record the candidate set, search coverage, and why the chosen Form is coherent before terminal review.",
    "candidateSet": [
      "No exact subject named; Form or category split required"
    ]
  },
  "failureModes": [],
  "maintenance": "3-7 years",
  "repairEconomics": "Not yet established. Compare parts, labor, access, downtime, and rational replacement cost before terminal review.",
  "counterCase": {
    "claim": "A serious alternative or incompatible sub-Form may answer the same broad category differently.",
    "disposition": "Counter-case not yet adjudicated; do not issue a terminal ruling until the strongest alternative is recorded and answered."
  },
  "futureRequirement": "Complete the evidence packet, five-gate findings, hard-disqualifier review, and human adjudication before promotion to DECLARED or EMPTY.",
  "confidence": 3,
  "notes": "Split into Glass Food Storage Containers vs Dry-Goods Containers (different sealing + failure modes). Seeded from the 100-record migration as a formal nonterminal case; this file does not issue a public ruling."
}
