{
  "id": "PI-C-0080",
  "category": "Hunting Knife",
  "slug": "hunting-knife",
  "status": "CANDIDATE",
  "constitutionVersion": "1.1.0",
  "form": {
    "statement": "The Buck 119 is a strong fixed-blade candidate inside a bounded field-use Form, not a universal answer to every knife job.",
    "scope": "Imported from the 100-record register as a nonterminal CANDIDATE research case. The ordinary use context, jurisdiction, and exact Form boundary remain part of adjudication.",
    "exclusions": [
      "Unstable tang or handle construction, unserviceable sheath, blade geometry mismatched to the Form, unsafe carry assumptions, and cosmetic preference treated as function."
    ]
  },
  "subject": {
    "manufacturer": "",
    "model": "Buck 119 Special, provisional model 0119BKS-B",
    "modelIdentifier": "",
    "productionLineage": "Exact model identity and production continuity remain to be verified."
  },
  "gates": [],
  "hardDisqualifiers": [],
  "evidenceIds": [],
  "evidenceGaps": [
    "Attach at least one primary technical or service source.",
    "Attach independent evidence of longevity, failure behavior, or repair economics.",
    "Record the strongest counter-case and the exact model or child Form boundary."
  ],
  "categorySearch": {
    "protocol": "Research disposition imported from the canonical register. The case must record the candidate set, search coverage, and why the chosen Form is coherent before terminal review.",
    "candidateSet": [
      "Buck 119 Special, provisional model 0119BKS-B"
    ]
  },
  "failureModes": [
    {
      "mode": "Register failure-mode record",
      "severity": "MEDIUM",
      "remedy": "Edge loss, handle damage, sheath wear, corrosion, and misuse outside field-processing tasks."
    }
  ],
  "maintenance": "Sharpen and refinish the blade; replace or repair sheath and handle components where supported.",
  "repairEconomics": "Not yet established. Compare parts, labor, access, downtime, and rational replacement cost before terminal review.",
  "counterCase": {
    "claim": "A serious alternative or incompatible sub-Form may answer the same broad category differently.",
    "disposition": "Counter-case not yet adjudicated; do not issue a terminal ruling until the strongest alternative is recorded and answered."
  },
  "futureRequirement": "Complete the evidence packet, five-gate findings, hard-disqualifier review, and human adjudication before promotion to DECLARED or EMPTY.",
  "confidence": 3,
  "notes": "Constitutional Batch 08 research disposition: declaration path. Candidate only; not a terminal ruling. Seeded from the 100-record migration as a formal nonterminal case; this file does not issue a public ruling."
}
